{
  "schema_version": 1,
  "kind": "ace2_strict_benchmark_interface",
  "base_commit": "bc0ff4d89341646b948564cd59e2c67307bdea38",
  "module": {
    "name": "ace2_shell",
    "source": {
      "path": "rtl/ace2_shell.sv",
      "git_blob": "8ea81496506d018fa8b1193347194226903c19bd",
      "sha256": "3022fead9cadae344876073921addace9f83c272f75615c42c0421ffa7959663"
    },
    "package_source": {
      "path": "rtl/ace2_pkg.sv",
      "git_blob": "e9d1c4dd9af22c1821444e820fece2463f0f9e89",
      "sha256": "de25e2b4ba09f89cee23b56101d808b00a83e310b440d86f27639f554f895ba1"
    },
    "parameters": [
      {"name": "HIDDEN_SIZE", "data_type": "integer", "signed": true, "default_expression": "ACE2_HIDDEN_SIZE", "resolved_default": 896},
      {"name": "LANES", "data_type": "integer", "signed": true, "default_expression": "ACE2_VECTOR_LANES", "resolved_default": 16},
      {"name": "ACT_WIDTH", "data_type": "integer", "signed": true, "default_expression": "8", "resolved_default": 8},
      {"name": "GAIN_WIDTH", "data_type": "integer", "signed": true, "default_expression": "16", "resolved_default": 16},
      {"name": "ACC_WIDTH", "data_type": "integer", "signed": true, "default_expression": "48", "resolved_default": 48},
      {"name": "INV_RMS_FRAC", "data_type": "integer", "signed": true, "default_expression": "30", "resolved_default": 30},
      {"name": "GAIN_FRAC", "data_type": "integer", "signed": true, "default_expression": "8", "resolved_default": 8},
      {"name": "PROJ_MAC_LANES", "data_type": "integer", "signed": true, "default_expression": "4", "resolved_default": 4},
      {"name": "PROJ_ACC_WIDTH", "data_type": "integer", "signed": true, "default_expression": "32", "resolved_default": 32},
      {"name": "PROJ_M_MAX", "data_type": "integer", "signed": true, "default_expression": "16", "resolved_default": 16},
      {"name": "SRAM_BANKS", "data_type": "integer", "signed": true, "default_expression": "ACE2_SRAM_BANKS", "resolved_default": 8},
      {"name": "SRAM_ADDR_WIDTH", "data_type": "integer", "signed": true, "default_expression": "ACE2_SRAM_ADDR_WIDTH", "resolved_default": 12}
    ],
    "ports": [
      {"name": "clk_i", "direction": "input", "net_type": "wire", "signed": false, "packed_range": null, "width": 1},
      {"name": "rst_ni", "direction": "input", "net_type": "wire", "signed": false, "packed_range": null, "width": 1},
      {"name": "csr_valid_i", "direction": "input", "net_type": "wire", "signed": false, "packed_range": null, "width": 1},
      {"name": "csr_ready_o", "direction": "output", "net_type": "wire", "signed": false, "packed_range": null, "width": 1},
      {"name": "csr_write_i", "direction": "input", "net_type": "wire", "signed": false, "packed_range": null, "width": 1},
      {"name": "csr_addr_i", "direction": "input", "net_type": "wire", "signed": false, "packed_range": "[31:0]", "width": 32},
      {"name": "csr_wdata_i", "direction": "input", "net_type": "wire", "signed": false, "packed_range": "[63:0]", "width": 64},
      {"name": "csr_wstrb_i", "direction": "input", "net_type": "wire", "signed": false, "packed_range": "[7:0]", "width": 8},
      {"name": "csr_rvalid_o", "direction": "output", "net_type": "reg", "signed": false, "packed_range": null, "width": 1},
      {"name": "csr_rready_i", "direction": "input", "net_type": "wire", "signed": false, "packed_range": null, "width": 1},
      {"name": "csr_rdata_o", "direction": "output", "net_type": "reg", "signed": false, "packed_range": "[63:0]", "width": 64},
      {"name": "csr_error_o", "direction": "output", "net_type": "reg", "signed": false, "packed_range": null, "width": 1},
      {"name": "irq_o", "direction": "output", "net_type": "wire", "signed": false, "packed_range": null, "width": 1},
      {"name": "cmd_valid_i", "direction": "input", "net_type": "wire", "signed": false, "packed_range": null, "width": 1},
      {"name": "cmd_ready_o", "direction": "output", "net_type": "wire", "signed": false, "packed_range": null, "width": 1},
      {"name": "cmd_opcode_i", "direction": "input", "net_type": "wire", "signed": false, "packed_range": "[7:0]", "width": 8},
      {"name": "cmd_flags_i", "direction": "input", "net_type": "wire", "signed": false, "packed_range": "[7:0]", "width": 8},
      {"name": "cmd_layer_id_i", "direction": "input", "net_type": "wire", "signed": false, "packed_range": "[7:0]", "width": 8},
      {"name": "cmd_m_i", "direction": "input", "net_type": "wire", "signed": false, "packed_range": "[15:0]", "width": 16},
      {"name": "cmd_n_i", "direction": "input", "net_type": "wire", "signed": false, "packed_range": "[15:0]", "width": 16},
      {"name": "cmd_k_i", "direction": "input", "net_type": "wire", "signed": false, "packed_range": "[15:0]", "width": 16},
      {"name": "cmd_sequence_position_i", "direction": "input", "net_type": "wire", "signed": false, "packed_range": "[15:0]", "width": 16},
      {"name": "cmd_completion_tag_i", "direction": "input", "net_type": "wire", "signed": false, "packed_range": "[15:0]", "width": 16},
      {"name": "cmd_src0_addr_i", "direction": "input", "net_type": "wire", "signed": false, "packed_range": "[63:0]", "width": 64},
      {"name": "cmd_src1_addr_i", "direction": "input", "net_type": "wire", "signed": false, "packed_range": "[63:0]", "width": 64},
      {"name": "cmd_dst_addr_i", "direction": "input", "net_type": "wire", "signed": false, "packed_range": "[63:0]", "width": 64},
      {"name": "cmd_scale_addr_i", "direction": "input", "net_type": "wire", "signed": false, "packed_range": "[63:0]", "width": 64},
      {"name": "cmd_scratch_addr_i", "direction": "input", "net_type": "wire", "signed": false, "packed_range": "[63:0]", "width": 64},
      {"name": "mem_req_valid_o", "direction": "output", "net_type": "wire", "signed": false, "packed_range": null, "width": 1},
      {"name": "mem_req_ready_i", "direction": "input", "net_type": "wire", "signed": false, "packed_range": null, "width": 1},
      {"name": "mem_req_write_o", "direction": "output", "net_type": "wire", "signed": false, "packed_range": null, "width": 1},
      {"name": "mem_req_addr_o", "direction": "output", "net_type": "wire", "signed": false, "packed_range": "[63:0]", "width": 64},
      {"name": "mem_req_len_o", "direction": "output", "net_type": "wire", "signed": false, "packed_range": "[15:0]", "width": 16},
      {"name": "mem_req_tag_o", "direction": "output", "net_type": "wire", "signed": false, "packed_range": "[7:0]", "width": 8},
      {"name": "mem_wvalid_o", "direction": "output", "net_type": "wire", "signed": false, "packed_range": null, "width": 1},
      {"name": "mem_wready_i", "direction": "input", "net_type": "wire", "signed": false, "packed_range": null, "width": 1},
      {"name": "mem_wdata_o", "direction": "output", "net_type": "wire", "signed": false, "packed_range": "[LANES*ACT_WIDTH-1:0]", "width": 128},
      {"name": "mem_wstrb_o", "direction": "output", "net_type": "wire", "signed": false, "packed_range": "[15:0]", "width": 16},
      {"name": "mem_wtag_o", "direction": "output", "net_type": "wire", "signed": false, "packed_range": "[7:0]", "width": 8},
      {"name": "mem_rvalid_i", "direction": "input", "net_type": "wire", "signed": false, "packed_range": null, "width": 1},
      {"name": "mem_rready_o", "direction": "output", "net_type": "wire", "signed": false, "packed_range": null, "width": 1},
      {"name": "mem_rdata_i", "direction": "input", "net_type": "wire", "signed": false, "packed_range": "[LANES*ACT_WIDTH-1:0]", "width": 128},
      {"name": "mem_rtag_i", "direction": "input", "net_type": "wire", "signed": false, "packed_range": "[7:0]", "width": 8},
      {"name": "mem_rerror_i", "direction": "input", "net_type": "wire", "signed": false, "packed_range": null, "width": 1},
      {"name": "mem_bvalid_i", "direction": "input", "net_type": "wire", "signed": false, "packed_range": null, "width": 1},
      {"name": "mem_bready_o", "direction": "output", "net_type": "wire", "signed": false, "packed_range": null, "width": 1},
      {"name": "mem_btag_i", "direction": "input", "net_type": "wire", "signed": false, "packed_range": "[7:0]", "width": 8},
      {"name": "mem_berror_i", "direction": "input", "net_type": "wire", "signed": false, "packed_range": null, "width": 1},
      {"name": "sram_req_valid_o", "direction": "output", "net_type": "wire", "signed": false, "packed_range": "[SRAM_BANKS-1:0]", "width": 8},
      {"name": "sram_req_ready_i", "direction": "input", "net_type": "wire", "signed": false, "packed_range": "[SRAM_BANKS-1:0]", "width": 8},
      {"name": "sram_write_o", "direction": "output", "net_type": "wire", "signed": false, "packed_range": "[SRAM_BANKS-1:0]", "width": 8},
      {"name": "sram_addr_o", "direction": "output", "net_type": "wire", "signed": false, "packed_range": "[SRAM_BANKS*SRAM_ADDR_WIDTH-1:0]", "width": 96},
      {"name": "sram_wdata_o", "direction": "output", "net_type": "wire", "signed": false, "packed_range": "[SRAM_BANKS*LANES*ACT_WIDTH-1:0]", "width": 1024},
      {"name": "sram_wstrb_o", "direction": "output", "net_type": "wire", "signed": false, "packed_range": "[SRAM_BANKS*16-1:0]", "width": 128},
      {"name": "sram_rdata_i", "direction": "input", "net_type": "wire", "signed": false, "packed_range": "[SRAM_BANKS*LANES*ACT_WIDTH-1:0]", "width": 1024},
      {"name": "sram_rvalid_i", "direction": "input", "net_type": "wire", "signed": false, "packed_range": "[SRAM_BANKS-1:0]", "width": 8},
      {"name": "busy_o", "direction": "output", "net_type": "wire", "signed": false, "packed_range": null, "width": 1},
      {"name": "cmd_done_valid_o", "direction": "output", "net_type": "wire", "signed": false, "packed_range": null, "width": 1},
      {"name": "cmd_done_ready_i", "direction": "input", "net_type": "wire", "signed": false, "packed_range": null, "width": 1},